{
  "$schema": "../schema.json",
  "title": "A null workflow version is compared, and mismatches",
  "rules": [
    "INT-8"
  ],
  "operation": "validate-snapshot",
  "given": {
    "definitionVersion": "3f2a9c0e1b7d4a65",
    "snapshot": {
      "workflowVersion": null
    }
  },
  "expect": {
    "valid": false,
    "versionMismatch": true
  }
}
